BaBo,"22 Feb, 1991",N/A,//in.bmscdn.com/iedb/movies/images/mobile/thumbnail/xlarge/babo-et00099853-29-03-2019-05-35-00.jpg,"BaBo is a Marathi drama directed by Ramesh Chaudhary, with Sachin Baburao Pawar & Trupti Sachin Pawar as the producer, forming part of the crew.",N/A,N/A,30,0
Bharat,"22 Feb, 1991",N/A,//in.bmscdn.com/iedb/movies/images/mobile/thumbnail/xlarge/bharat-et00068351-28-12-2017-04-24-35.jpg,"When he was eight years old, Bharat made a promise to his father: to keep the family together no matter what. It`s a promise he keeps over the next 60 years of his life, despite each decade throwing a new set of challenges at him: some humorous, some thrilling and a few even dangerous! ",N/A,N/A,9060,0
 X-Men: Dark Phoenix,"22 Feb, 1991",N/A,//in.bmscdn.com/iedb/movies/images/mobile/thumbnail/xlarge/x-men-dark-phoenix-et00058524-16-06-2017-11-21-55.jpg,"After the events of X-Men: Apocalypse, the X-Men are national heroes, known for tackling several risky missions. On one such mission Jean Grey is hit by the deadly radiation of a solar flare. She attains her maximum power and becomes the Phoenix. But before long Jean gains powers that corrupt her to the core and turns into the Dark Phoenix. The X-Men have little time to decide if the life of a teammate, a woman they cherish, is worth more than the existence of the entire world and its people.",N/A,N/A,45964,0
Sandeep Aur Pinky Faraar,"22 Feb, 1991",N/A,//in.bmscdn.com/iedb/movies/images/mobile/thumbnail/xlarge/sandeep-aur-pinky-faraar-et00059172-03-07-2017-12-21-03.jpg,"A man and woman hailing from two different parts of India are united owing to their mistrust, suspicion, and hate for each other.",N/A,N/A,4602,0
Mogra Phulaalaa,"22 Feb, 1991",N/A,//in.bmscdn.com/iedb/movies/images/mobile/thumbnail/xlarge/mogra-phulaalaa-et00097165-22-02-2019-10-26-45.jpg,Mogra Phulaalaa is a Marathi movie starring Swwapnil Joshi and Neena Kulkarni in prominent roles. It is a drama directed by Shrabani Deodhar.,N/A,N/A,16,0
Toy Story 4,"22 Feb, 1991",N/A,//in.bmscdn.com/iedb/movies/images/mobile/thumbnail/xlarge/toy-story-4-et00046525-16-09-2016-01-23-38.jpg,"Woody has always been confident about his place in the world and that his priority is taking care of his kid, whether that's Andy or Bonnie. But when Bonnie adds a reluctant new toy called ""Forky"" to her room, a road trip adventure alongside old and new friends will show Woody how big the world can be for a toy.",N/A,N/A,13974,0
Kabir Singh,"22 Feb, 1991",N/A,//in.bmscdn.com/iedb/movies/images/mobile/thumbnail/xlarge/arjun-reddy-et00080853-31-07-2018-04-53-00.jpg,A brilliant yet impulsive young surgeon falls into a path of self-destruction after the love of his life is forced to marry another man.,N/A,N/A,3229,0
Shadaa,"22 Feb, 1991",N/A,//in.bmscdn.com/iedb/movies/images/mobile/thumbnail/xlarge/shadaa-et00082402-24-08-2018-11-12-16.jpg,Shadaa is a Punjabi movie starring Diljit Dosanjh and Neeru Bajwa in prominent roles. It is a drama directed by Jagdeep Sidhu.,N/A,N/A,1104,0
Drive,"22 Feb, 1991",N/A,//in.bmscdn.com/iedb/movies/images/mobile/thumbnail/xlarge/drive-et00054134-01-03-2017-02-56-36.jpg,Drive is a Hindi movie starring Sushant Singh Rajput and Jacqueline Fernandes in prominent roles. It is an action-thriller adventure directed by Tarun Mansukhani.,N/A,N/A,12802,0
Annabelle Comes Home,"22 Feb, 1991",N/A,//in.bmscdn.com/iedb/movies/images/mobile/thumbnail/xlarge/annabelle-comes-home-et00099889-31-03-2019-10-15-19.jpg,"Paranormal investigators Ed and Lorraine Warren keep a possessed doll locked up in an artifacts room in their house. When the doll awakens the room's evil spirits, it soon becomes a night of terror for the couple's young daughter and her friends.",N/A,N/A,3365,0
Takatak,"22 Feb, 1991",N/A,//in.bmscdn.com/iedb/movies/images/mobile/thumbnail/xlarge/takatak-et00100381-08-04-2019-11-07-36.jpg,"Takatak is a Marathi movie starring Prathamesh Parab, Ritika Shrotri, Abhijit Amkar and Pranali Bhalerao in prominent roles. It is a drama directed by Milind Kavde.",N/A,N/A,8,0
Mindo Taseeldarni,"22 Feb, 1991",N/A,//in.bmscdn.com/iedb/movies/images/mobile/thumbnail/xlarge/mindo-taseeldarni-et00089432-28-11-2018-12-55-15.jpg,Mindo Taseeldarni is a Punjabi movie starring Kavita Kaushik in a prominent role. It is a drama directed by Avtar Singh.  ,N/A,N/A,138,0
Satellite Shankar,"22 Feb, 1991",N/A,//in.bmscdn.com/iedb/movies/images/mobile/thumbnail/xlarge/satellite-shankar-et00083016-03-09-2018-12-33-19.jpg,Satellite Shankar is a Hindi movie starring Sooraj Pancholi in a prominent role. It is a drama directed by Irfan Kamal.,N/A,N/A,407,0
Spider-Man: Far From Home,"22 Feb, 1991",N/A,//in.bmscdn.com/iedb/movies/images/mobile/thumbnail/xlarge/spider-man-far-from-home-et00078437-25-06-2018-02-54-59.jpg,After the events of the untitled Avengers film Peter Parker and his friends go on summer vacation to Europe and there Peter finds himself trying to save his friends against a villain known as Mysterio.,N/A,N/A,16097,0
Jabariya Jodi,"22 Feb, 1991",N/A,//in.bmscdn.com/iedb/movies/images/mobile/thumbnail/xlarge/shotgun-shaadi-et00075290-07-05-2018-04-07-40.jpg,"Based on groom kidnappings in Bihar, where the groom is kidnapped to avoid dowry, the film has Siddharth Malhotra playing a thug who helps kidnap grooms. It also features Parineeti Chopra in a prominent role.",N/A,N/A,2042,0
Jai Mummy Di,"22 Feb, 1991",N/A,//in.bmscdn.com/iedb/movies/images/mobile/thumbnail/xlarge/jai-mummy-di-et00096771-18-02-2019-12-04-28.jpg,"Jai Mummy Di is a light-hearted family comedy revolving around two mothers and their kids. What follows is how these kids deal with their mommy issues, which leads to utter chaos.",N/A,N/A,52,0
A Biopic from the Film Industry,"22 Feb, 1991",N/A,//in.bmscdn.com/iedb/movies/images/mobile/thumbnail/xlarge/a-biopic-from-the-film-industry-et00100130-03-04-2019-04-13-11.jpg,A simple girl from Punjab comes to the big city with dreams in her eyes. The plot revolves around her struggle to stardom and how she handles her success once she reaches the top.,N/A,N/A,18,0
Top Gun: Maverick,"22 Feb, 1991",N/A,//in.bmscdn.com/iedb/movies/images/mobile/thumbnail/xlarge/top-gun-maverick-et00076943-04-06-2018-03-03-27.jpg,"Over three decades after the action drama Top Gun released in 1986, Tom Cruise reprises his role of Pete ""Maverick"" Mitchell in the second installment of the Top Gun series - Top Gun: Maverick in 2019 written by Peter Craig.",N/A,N/A,2434,0
Arjun Patiala,"22 Feb, 1991",N/A,//in.bmscdn.com/iedb/movies/images/mobile/thumbnail/xlarge/arjun-patiala-et00064800-07-11-2017-05-14-17.jpg,Arjun Patiala is a Hindi movie starring Diljith Dosanth and Kriti Sanon in prominent roles. It is a comedy drama produced by Dinesh Vijan.,N/A,N/A,2950,0
The Lion King,"22 Feb, 1991",N/A,//in.bmscdn.com/iedb/movies/images/mobile/thumbnail/xlarge/the-lion-king-2019-et00089130-23-11-2018-01-42-40.jpg,"""The Lion King"" journeys to the African savanna where a future king must overcome betrayal and tragedy to assume his rightful place on Pride Rock.",N/A,N/A,9345,0
Pal Pal Dil Ke Paas,"22 Feb, 1991",N/A,//in.bmscdn.com/iedb/movies/images/mobile/thumbnail/xlarge/pal-pal-dil-ke-paas-et00096630-14-02-2019-03-40-34.jpg,"Pal Pal Dil Ke Paas is a Hindi movie starring Karan Deol in prominent roles. It is a drama directed by Sunny Deol.If you are a representative of the production house, please share the details of the film with [email protected]",N/A,N/A,234,0
Smile Please,"22 Feb, 1991",N/A,//in.bmscdn.com/iedb/movies/images/mobile/thumbnail/xlarge/smile-please-et00100333-05-04-2019-06-32-15.jpg,Smile Please is a Marathi movie starring Mukta Barve and Lalit Prabhakar in prominent roles. It is a drama directed by Vikram Phadnis.,N/A,N/A,1,0
Super 30,"22 Feb, 1991",N/A,//in.bmscdn.com/iedb/movies/images/mobile/thumbnail/xlarge/super-30-et00064569-03-11-2017-12-22-53.jpg,"Anand Kumar, a Mathematics genius from a modest family in Bihar who is made to believe that only a King's son can become a king is on a mission to prove that even the poor man can create some of the world's most genius minds. He starts a training program named 'Super 30' to help 30 IIT aspirants crack the entrance test and make them highly successful professionals.",N/A,N/A,12863,0
Hobbs and Shaw,"22 Feb, 1991",N/A,//in.bmscdn.com/iedb/movies/images/mobile/thumbnail/xlarge/hobbs-and-shaw-et00074077-13-04-2018-11-38-02.jpg,"A spinoff of the Fate of the Furious, focusing on Johnson's US Diplomatic Security Agent Luke Hobbs forming an unlikely alliance with Statham's Deckard Shaw.",N/A,N/A,7472,0
Once Upon A Time In Hollywood,"22 Feb, 1991",N/A,//in.bmscdn.com/iedb/movies/images/mobile/thumbnail/xlarge/once-upon-a-time-in-hollywood-et00077261-08-06-2018-11-32-27.jpg,"The film tells the story of a TV actor and his stunt double who embark on a journey to make a name for themselves in 1969 Hollywood, during the Charles Manson murders.",N/A,N/A,3554,0
Stuber,"22 Feb, 1991",N/A,//in.bmscdn.com/iedb/movies/images/mobile/thumbnail/xlarge/stuber-et00089325-27-11-2018-12-47-03.jpg,"If you are a representative of the production house, please share the details of the film with [email protected]",N/A,N/A,49,0
The New Mutants,"22 Feb, 1991",N/A,//in.bmscdn.com/iedb/movies/images/mobile/thumbnail/xlarge/new-mutants-et00063623-13-10-2017-02-43-50.jpg,"After five young mutants who are held in a remote secret facility discover their abilities, they embark on a journey to save themselves.",N/A,N/A,5363,0
Dora And The Lost City Of Gold,"22 Feb, 1991",N/A,//in.bmscdn.com/iedb/movies/images/mobile/thumbnail/xlarge/dora-and-the-lost-city-of-gold-et00099589-26-03-2019-10-50-02.jpg,"Though she has spent most of her life exploring the jungle and embracing adventures, nothing could have prepared Dora for the crazy world of high school. Along with a ragtag group of teens and her trusted sidekick Boots the Monkey, she embarks on an epic quest to rediscover a lost Incan civilization, while also trying to save her parents from impending trouble.",N/A,N/A,652,0
Artemis Fowl,"22 Feb, 1991",N/A,//in.bmscdn.com/iedb/movies/images/mobile/thumbnail/xlarge/artermis-fowl-et00089430-28-11-2018-11-59-39.jpg,"Disney's ""Artemis Fowl,"" based on the beloved book by Eoin Colfer, is a fantastical, spellbinding adventure that follows the journey of 12-year-old genius Artemis Fowl, a descendant of a long line of criminal masterminds, as he seeks to find his father who has mysteriously disappeared. With the help of his loyal protector Butler, Artemis sets out to find him, and in doing so uncovers an ancient, underground civilization-the amazingly advanced world of fairies. Deducing that his father's disappearance is somehow connected to the secretive, reclusive fairy world, cunning Artemis concocts a dangerous plan so dangerous that he ultimately finds himself in a perilous war of wits with the all powerful fairies.",N/A,N/A,1929,0
Batla House,"22 Feb, 1991",N/A,//in.bmscdn.com/iedb/movies/images/mobile/thumbnail/xlarge/batla-house-et00075855-16-05-2018-12-23-04.jpg,"Based on the 2008 Delhi Batla House case, the crime thriller Batla House chronicles the police encounter and investigation of the case.",N/A,N/A,2368,0
Made In China,"22 Feb, 1991",N/A,//in.bmscdn.com/iedb/movies/images/mobile/thumbnail/xlarge/made-in-china-et00080071-18-07-2018-06-45-17.jpg,A struggling Gujarati businessman heads to China in a quest for better prospects. Will his eventful journey full of ups and downs and misadventures eventually help him become a  successful entrepreneur?,N/A,N/A,1285,0
Saaho,"22 Feb, 1991",N/A,//in.bmscdn.com/iedb/movies/images/mobile/thumbnail/xlarge/saaho-et00056595-28-04-2017-10-26-00.jpg,"Saaho is a multi-lingual movie starring Prabhas and Shraddha Kapoor in prominent roles. The cast also includes Neil Nitin Mukesh and Jackie Shroff. It is a drama directed by Sujeeth with Shankar Mahadevan, Ehsaan Noorani and Loy Mendonsa as the music composers, forming part of the crew.",N/A,N/A,67326,0
Ye Re Ye Re Paisa 2,"22 Feb, 1991",N/A,//in.bmscdn.com/iedb/movies/images/mobile/thumbnail/xlarge/ye-re-ye-re-paisa-2-et00077482-12-06-2018-05-16-01.jpg,"Ye Re Ye Re Paisa 2 is a Marathi movie directed by Hemant Dhome, with Hrishikesh Koli as the writer, forming a part of the crew.",N/A,N/A,1689,0
Chhichhore,"22 Feb, 1991",N/A,//in.bmscdn.com/iedb/movies/images/mobile/thumbnail/xlarge/chhichhore-et00085935-09-10-2018-11-33-49.jpg,Chhichhore is a Hindi movie starring Sushant Singh Rajput and Shraddha Kapoor in prominent roles. The movie also stars Varun Sharma. It is a drama directed by Nitesh Tiwari.,N/A,N/A,1045,0
Good News,"22 Feb, 1991",N/A,//in.bmscdn.com/iedb/movies/images/mobile/thumbnail/xlarge/good-news-et00080999-02-08-2018-12-31-33.jpg,"Good News is a Hindi movie starring Akshay Kumar, Kareena Kapoor Khan, Diljit Dosanjh and Kaira Advani in prominent roles. It is a drama directed by Raj Mehta, forming part of the crew.",N/A,N/A,1639,0
It: Chapter 2,"22 Feb, 1991",N/A,//in.bmscdn.com/iedb/movies/images/mobile/thumbnail/xlarge/chapter-2-et00077370-11-06-2018-12-09-47.jpg,"Evil resurfaces in Derry as director Andy Muschietti reunites the Losers Club-young and adult-in a return to where it all began with ""IT CHAPTER TWO."" The film is Muschietti's follow-up to 2017's critically acclaimed and massive worldwide box office hit ""IT,"" which grossed over $700 million globally.  Both redefining and transcending the genre, ""IT"" became part of the cultural zeitgeist as well as the highest-grossing horror film of all time. Because every 27 years evil revisits the town of Derry, Maine, ""IT CHAPTER TWO"" brings the characters-who've long since gone their separate ways-back together as adults, nearly three decades after the events of the first film.",N/A,N/A,4619,0
Dream Girl,"22 Feb, 1991",N/A,//in.bmscdn.com/iedb/movies/images/mobile/thumbnail/xlarge/dream-girl-et00089745-30-11-2018-04-32-07.jpg,Dream Girl is a Hindi movie starring Ayushmann Khurrana and Nushrat Bharuchain prominent roles. It is a drama written & directed by Raaj Shaandilyaa.,N/A,N/A,1349,0
Spies In Disguise,"22 Feb, 1991",N/A,//in.bmscdn.com/iedb/movies/images/mobile/thumbnail/xlarge/spies-in-disguise-et00072276-10-03-2018-03-41-39.jpg,"Spies In Disguise is an English movie starring Will Smith and Tom Holland in prominent roles. It is an animated action adventure directed by Nick Bruno with Peter Chernin as producer, forming part of the crew.",N/A,N/A,995,0
Daaka,"22 Feb, 1991",N/A,//in.bmscdn.com/iedb/movies/images/mobile/thumbnail/xlarge/daaka-et00097118-21-02-2019-04-31-45.jpg,Daaka is a Punjabi movie starring  Gippy Grewal and Zareen Khan in prominent roles. It is a drama directed by Baljit Singh Deo.,N/A,N/A,83,0
Nikka Zaildar 3,"22 Feb, 1991",N/A,//in.bmscdn.com/iedb/movies/images/mobile/thumbnail/xlarge/nikka-zaildar-3-et00100207-04-04-2019-01-39-19.jpg,"Nikka Zaildar 3 is a Punjabi movie starring Ammy Virk, Wamiqa Gabbi, Sonia Kour, Nirmal Rishi and Baninderjit Bunny in prominent roles. It is a drama directed by Simerjit Singh.",N/A,N/A,33,0
Abominable,"22 Feb, 1991",N/A,//in.bmscdn.com/iedb/movies/images/mobile/thumbnail/xlarge/abominable-et00096697-15-02-2019-03-02-29.jpg,"Abominable is an English movie starring Tsai Chin in prominent roles. It is a aniimation directed by Jill Culton, with Rupert Gregson-Williams as musician, forming part of the crew.",N/A,N/A,31,0
Doorbeen,"22 Feb, 1991",N/A,//in.bmscdn.com/iedb/movies/images/mobile/thumbnail/xlarge/doorbeen-et00100001-02-04-2019-12-25-53.jpg,"Doorbeen is a Punjabi movie starring Wamiqa Gabbi, Yograj Singh and Karamjit Anmol in prominent roles. It is a drama directed by Ishan Chopra.",N/A,N/A,11,0
Gaalib,"22 Feb, 1991",N/A,//in.bmscdn.com/iedb/movies/images/mobile/thumbnail/xlarge/gaalib-et00084598-22-09-2018-12-03-42.jpg,Gaalib  is a Marathi movie starring Deepika Chikhalia and Anil Rastogi in prominent roles. It is a drama directed by Manoj Giri.,N/A,N/A,25,0
Rambo,"22 Feb, 1991",N/A,//in.bmscdn.com/iedb/movies/images/mobile/thumbnail/xlarge/rambo-et00057464-20-05-2017-01-24-43.jpg,"Rambo is a Hindi movie starring Tiger Shroff and Hrithik Roshan in prominent roles. It is an action drama directed by Siddarth Anand.If you are a representative of the production house, please share the details of the film with [email protected]",N/A,N/A,9231,0
Marjaavaan,"22 Feb, 1991",N/A,//in.bmscdn.com/iedb/movies/images/mobile/thumbnail/xlarge/marjaavaan-et00087452-31-10-2018-10-20-39.jpg,"Marjaavaan is a Hindi movie starring Riteish Deshmukh, Sidharth Malhotra and Tara Sutaria in prominent roles. It is a drama directed by  Milap Milan Zaveri.",N/A,N/A,567,0
Gemini Man,"22 Feb, 1991",N/A,//in.bmscdn.com/iedb/movies/images/mobile/thumbnail/xlarge/gemini-man-et00071776-01-03-2018-04-05-10.jpg,"Henry Brogan, an elite assassin, is suddenly targeted and pursued by a mysterious young operative that seemingly can predict his every move.",N/A,N/A,315,0
The Woman In The Window,"22 Feb, 1991",N/A,//in.bmscdn.com/iedb/movies/images/mobile/thumbnail/xlarge/the-woman-in-the-window-et00089327-27-11-2018-12-52-09.jpg,"The film revolves around a woman who has been living alone in New York City. Drinking wine, watching movies and spying on her neighbors are her favourite pass times.  Meanwhile, a new family moves into the house across the way and she begins to spy on them. One day, while looking out of the window, she witnesses something that she shouldn't have. Will this change her life forever? Will danger befall on her? Will she be able to escape the situation?",N/A,N/A,235,0
Joker,"22 Feb, 1991",N/A,//in.bmscdn.com/iedb/movies/images/mobile/thumbnail/xlarge/joker-et00100071-03-04-2019-10-23-41.jpg,"A chilling origin story to one of the most iconic comic book supervillains, the film follows a failed stand-up comedian in the city of Gotham who is ostracized by the society and soon turns into a life of crime after being driven insane.",N/A,N/A,3780,0
Password,"22 Feb, 1991",N/A,//in.bmscdn.com/iedb/movies/images/mobile/thumbnail/xlarge/password-et00097268-24-02-2019-09-36-41.jpg,Password is a Bengali movie starring Dev Adhikari  and Paoli Dam in prominent roles. It is a drama directed by Kamaleshwar Mukherjee.,N/A,N/A,54,0
The Sky Is Pink,"22 Feb, 1991",N/A,//in.bmscdn.com/iedb/movies/images/mobile/thumbnail/xlarge/the-sky-is-pink-et00082248-22-08-2018-01-02-12.jpg,"Based on My Little Epiphanies, The Sky Is Pink chronicles the life of Aisha Chaudhary, who became an inspirational speaker after being diagnosed with pulmonary fibrosis when she was thirteen-years-old.",N/A,N/A,382,0
Jungle Cruise ,"22 Feb, 1991",N/A,//in.bmscdn.com/iedb/movies/images/mobile/thumbnail/xlarge/jungle-cruise-et00081136-05-08-2018-12-18-51.jpg,"Based on Disneyland's theme park ride where a small riverboat takes a group of travelers through a jungle filled with dangerous animals and reptiles, but with a supernatural element.",N/A,N/A,775,0
Maleficent 2,"22 Feb, 1991",N/A,//in.bmscdn.com/iedb/movies/images/mobile/thumbnail/xlarge/maleficent-2-et00076688-30-05-2018-09-44-05.jpg,"The second installment of the epic fantasy adventure follows the ascendant princess Aurora and the darkly charismatic Maleficent as they try to navigate the complex dynamics between them, form new alliances and confront new adversaries - all in a bid to protect their land and its subjects.",N/A,N/A,1528,0
Kaithi,"22 Feb, 1991",N/A,//in.bmscdn.com/iedb/movies/images/mobile/thumbnail/xlarge/kaithi-et00098319-08-03-2019-05-13-44.jpg,"If you are a representative of the production house, please share the details of the film with [email protected]",N/A,N/A,109,0
Jinde Meriye,"22 Feb, 1991",N/A,//in.bmscdn.com/iedb/movies/images/mobile/thumbnail/xlarge/jinde-meriye-et00097403-26-02-2019-10-01-37.jpg,"If you are a representative of the production house, please share the details of the film with [email protected]",N/A,N/A,56,0
ABCD 3,"22 Feb, 1991",N/A,//in.bmscdn.com/iedb/movies/images/mobile/thumbnail/xlarge/abcd-3-et00072721-19-03-2018-11-23-29.jpg,ABCD 3 is a Hindi movie starring Varun Dhawan and Katrina Kaif in prominent roles. It is a dance musical directed by Remo D'Souza.,N/A,N/A,4760,0
Street Dancer 3,"22 Feb, 1991",N/A,//in.bmscdn.com/iedb/movies/images/mobile/thumbnail/xlarge/street-dancer-3-et00095633-05-02-2019-12-53-08.jpg,Street Dancer 3 is a Hindi movie starring  Varun Dhawan and Shraddha Kapoor in prominent roles. It is an action drama directed by Remo D'Souza.,N/A,N/A,1361,0
Terminator,"22 Feb, 1991",N/A,//in.bmscdn.com/iedb/movies/images/mobile/thumbnail/xlarge/terminator-et00080990-02-08-2018-09-42-35.jpg,"If you are a representative of the production house, please share the details of the film with  [email protected]",N/A,N/A,2549,0
Frozen 2,"22 Feb, 1991",N/A,//in.bmscdn.com/iedb/movies/images/mobile/thumbnail/xlarge/frozen-2-et00056551-26-04-2017-07-17-17.jpg,"Frozen 2 is an English movie starring Idina Menzel, Kristen Bell and Jonathan Groff in prominent roles. It is an animated fantasy drama directed by Chris Buck and Jennifer Lee.",N/A,N/A,6444,0
Dil Bechara,"22 Feb, 1991",N/A,//in.bmscdn.com/iedb/movies/images/mobile/thumbnail/xlarge/dil-bechara-et00098454-11-03-2019-04-22-57.jpg,Dil Bechara is a Hindi movie starring Sushant Singh Rajput and Sanjana Sanghi in prominent roles. It is a drama directed by Mukesh Chhabra.,N/A,N/A,71,0
Romeo Akbar Walter,"05 Apr, 2019",UA ,//in.bmscdn.com/iedb/movies/images/mobile/thumbnail/xlarge/romeo-akbar-walter-et00055220-27-03-2017-12-51-54.jpg,"Romeo Akbar Walter (RAW) is a spy thriller that is set against the backdrop of the Indo-Pakistani War of 1971. The film, which is inspired by true events, is directed by Robby Grewal.",N/A,N/A,"8,473",1
Shazam!,"05 Apr, 2019",UA ,//in.bmscdn.com/iedb/movies/images/mobile/thumbnail/xlarge/shazam!-et00072971-23-03-2018-03-00-06.jpg,"We all have a superhero inside us, it just takes  a bit of magic to bring it out. In Billy Batson`s (Angel) case, by shouting out one word - SHAZAM! This streetwise 14-year-old foster kid can turn into the adult Super Hero Shazam (Levi), courtesy of an ancient wizard.  Still, a kid at heart-inside a ripped, godlike body-Shazam revels in this adult version of himself by doing what any teen would do with superpowers: have fun with them!  Can he fly?  Does he have X-ray vision? Can he shoot lightning out of his hands? Can he skip his social studies test? Shazam sets out to test the limits of his abilities with the joyful recklessness of a child.  But he`ll need to master these powers quickly in order to fight the deadly forces of evil controlled by Dr. Thaddeus Sivana.",N/A,2 hrs 12 mins,"12,527",1
Kesari,"21 Mar, 2019",UA ,//in.bmscdn.com/iedb/movies/images/mobile/thumbnail/xlarge/kesari-et00063382-11-10-2017-11-37-54.jpg,"Set in the 19th century, Kesari recounts the story of Havildar Ishar SIngh who played a key role in the 1897 Battle of Saragarhi, in which an army of 21 Sikhs fought against a legion of Afghans in what is considered as one of the greatest last-stands in military history.",N/A,2 hrs 30 mins,"67,075",1
Dumbo,"29 Mar, 2019",U ,//in.bmscdn.com/iedb/movies/images/mobile/thumbnail/xlarge/dumbo-et00099533-25-03-2019-02-26-29.jpg,"From Disney and visionary director Tim Burton, the all-new grand live-action adventure ""Dumbo"" expands on the beloved classic story where differences are celebrated, family is cherished and dreams take flight. Circus owner Max Medici (Danny DeVito) enlists former star Holt Farrier (Colin Farrell) and his children Milly (Nico Parker) and Joe (Finley Hobbins) to care for a newborn elephant whose oversized ears make him a laughingstock in an already struggling circus. But when they discover that Dumbo can fly, the circus makes an incredible comeback, attracting persuasive entrepreneur V.A. Vandevere (Michael Keaton), who recruits the peculiar pachyderm for his newest, larger-than-life entertainment venture, Dreamland.",N/A,1 hrs 52 mins,"5,519",1
Badla,"08 Mar, 2019",UA ,//in.bmscdn.com/iedb/movies/images/mobile/thumbnail/xlarge/badla-et00077951-19-06-2018-10-46-53.jpg,"A young dynamic entrepreneur finds herself in a locked hotel room next to the body of her dead lover. She hires a prestigious lawyer to defend her, and over the course of one evening, they work together to find out what actually happened.",N/A,2 hrs 00 mins,"65,671",1
Junglee,"29 Mar, 2019",UA ,//in.bmscdn.com/iedb/movies/images/mobile/thumbnail/xlarge/junglee-et00065129-13-11-2017-03-34-14.jpg,"On returning to the beloved elephant reserve once managed by his father, a young man encounters and takes on an international racket of poachers.",N/A,1 hrs 55 mins,"7,584",1
Lucifer ,"05 Apr, 2019",UA ,//in.bmscdn.com/iedb/movies/images/mobile/thumbnail/xlarge/lucifer-et00019224-27-03-2018-05-47-18.jpg,"In God`s own country, the supreme leader of the ruling party dies, leaving a huge vacuum, not only in the electoral and leadership sphere of the party but also that of the state. In the inevitable succession squabble and the power struggle that ensues, the thin line that separates good and bad becomes irrecoverably blurred and out of this seemingly endless mayhem, emerge forces that are hitherto unheard of.  ",N/A,2 hrs 54 mins,"68,554",1
PM Narendra Modi,"11 Apr, 2019",U ,//in.bmscdn.com/iedb/movies/images/mobile/thumbnail/xlarge/pm-narendra-modi-et00093485-05-01-2019-01-18-54.jpg,"This film is the inspiring saga of a man, a politician, a leader and a visionary - the Prime Minister of India, Narendra Damodar Das Modi. It chronicles his 64 - year epic journey, from abject poverty, selling tea on a railway station as a chaiwala (tea seller) to becoming the Leader of the world`s largest democracy. The film ""PM Narendra Modi"" is the shining symbol of the victory of a common man.",N/A,2 hrs 11 mins,0,1
