Airaa,"28 Mar, 2019",UA ,//in.bmscdn.com/iedb/movies/images/mobile/thumbnail/xlarge/airaa-et00085991-09-10-2018-05-13-52.jpg,"While enjoying a vacation in her grandma`s village bungalow, Yamuna comes up with the idea of  shooting staged `Live Ghost Experience` videos. However, once she starts filming, Yamuna starts experiencing real paranormal presence in the bungalow, which tests the limits of her rational thinking.",N/A,2 hrs 22 mins,"4,905",1
Romeo Akbar Walter,"05 Apr, 2019",UA ,//in.bmscdn.com/iedb/movies/images/mobile/thumbnail/xlarge/romeo-akbar-walter-et00055220-27-03-2017-12-51-54.jpg,"Romeo Akbar Walter (RAW) is a spy thriller that is set against the backdrop of the Indo-Pakistani War of 1971. The film, which is inspired by true events, is directed by Robby Grewal.",N/A,N/A,"8,490",1
The Least Of These,"29 Mar, 2019",UA ,//in.bmscdn.com/iedb/movies/images/mobile/thumbnail/xlarge/the-least-of-these-et00097770-01-03-2019-03-43-23.jpg,"In the late 1990s, journalist Manav Banerjee moves to Orissa along with his pregnant wife hoping to start fresh and chasing the promise of a lucrative career. As an undercover reporter for a newspaper, he sets to find out whether there is any truth to the rumours that Australian missionary Graham Staines is illegally proselytizing leprosy patients.",N/A,1 hrs 55 mins,"3,260",1
Madhuraraja,"12 Apr, 2019",UA ,//in.bmscdn.com/iedb/movies/images/mobile/thumbnail/xlarge/madhuraraja-et00081507-10-08-2018-08-32-35.jpg,"When an illegal hooch baron`s reign of terror troubles an entire village, the people turn to the only man who can save them: Raja, the flamboyant don with a heart of gold.",N/A,2 hrs 27 mins,0,1
Chitralahari,"12 Apr, 2019",U ,//in.bmscdn.com/iedb/movies/images/mobile/thumbnail/xlarge/chitralahari-et00094348-18-01-2019-10-45-26.jpg,"Down on luck and depressed by constant failures in personal and professional life, Vijay is desperately in search of that single stroke of fortune that could turn his life around. But what if the power to rewrite his destiny lies within?",N/A,2 hrs 11 mins,0,1
How To Train Your Dragon: The Hidden World,"21 Mar, 2019",U ,//in.bmscdn.com/iedb/movies/images/mobile/thumbnail/xlarge/how-to-train-your-dragon-the-hidden-world-et00098625-13-03-2019-09-51-59.jpg,"What began as an unlikely friendship between an adolescent Viking and a fearsome Night Fury dragon has become an epic trilogy spanning their lives. In this next chapter, Hiccup and Toothless will finally discover their true destinies: the village chief as ruler of Berk alongside Astrid, and the dragon as leader of his own kind. As both ascend, the darkest threat they've yet faced-as well as the appearance of a female Night Fury-will test the bonds of their relationship like never before.",N/A,1 hrs 44 mins,"12,028",1
Captain Marvel,"08 Mar, 2019",UA ,//in.bmscdn.com/iedb/movies/images/mobile/thumbnail/xlarge/captain-marvel-et00097168-22-02-2019-11-00-25.jpg,"Set in the 1990s, Marvel Studios` ""Captain Marvel"" is an all-new adventure from a previously unseen period in the history of the Marvel Cinematic Universe that follows the journey of Carol Danvers as she becomes one of the universe`s most powerful heroes. While a galactic war between two alien races reaches Earth, Danvers finds herself and a small cadre of allies at the center of the maelstrom.",N/A,2 hrs 04 mins,"88,487",1
Watchman,"12 Apr, 2019",U ,//in.bmscdn.com/iedb/movies/images/mobile/thumbnail/xlarge/watchman-et00096715-15-02-2019-05-09-14.jpg,"Events take a bizarre turn when a man, just a day away from his engagement with his girlfriend, is threatened by the local goon to stop his engagement if he fails to settle his debt with him. Will he be able to repay his debts and get engaged to his beloved?",N/A,1 hrs 35 mins,0,1
Hellboy,"12 Apr, 2019",A ,//in.bmscdn.com/iedb/movies/images/mobile/thumbnail/xlarge/hellboy-2018-et00087698-05-11-2018-11-17-31.jpg,"Based on the graphic novels by Mike Mignola, the film follows Hellboy - the beloved son of the Fallen One who is caught between the worlds of the supernatural and human. This time around, his formidable enemy is an ancient sorceress bent on revenge.",N/A,2 hrs 03 mins,0,1
Mera Naam Shaji,"05 Apr, 2019",U ,//in.bmscdn.com/iedb/movies/images/mobile/thumbnail/xlarge/mera-naam-shaji-et00099762-28-03-2019-04-42-51.jpg,"The lives of three men sharing the same name intertwine, leading to a series of hilarious incidents. Directed by Nadirshah, Mere Naam Shaji stars Asif Ali, Biju Menon and Baiju Santhosh in the lead roles.",N/A,2 hrs 14 mins,"7,730",1
Kesari,"21 Mar, 2019",UA ,//in.bmscdn.com/iedb/movies/images/mobile/thumbnail/xlarge/kesari-et00063382-11-10-2017-11-37-54.jpg,"Set in the 19th century, Kesari recounts the story of Havildar Ishar SIngh who played a key role in the 1897 Battle of Saragarhi, in which an army of 21 Sikhs fought against a legion of Afghans in what is considered as one of the greatest last-stands in military history.",N/A,2 hrs 30 mins,"67,087",1
Ispade Rajavum Idhaya Raniyum,"15 Mar, 2019",UA ,//in.bmscdn.com/iedb/movies/images/mobile/thumbnail/xlarge/ispade-rajavum-idhaya-raniyum-et00096041-07-02-2019-02-43-55.jpg,"Ispade Rajavum Idhaya Raniyum chronicles the whirlwind romance between Gowtham and Tara, who are drawn to each other despite their differences. Will the relationship survive the troubles caused by their contrasting personalities?",N/A,2 hrs 33 mins,"3,309",1
The Tashkent Files,"12 Apr, 2019",UA ,//in.bmscdn.com/iedb/movies/images/mobile/thumbnail/xlarge/the-tashkent-files-et00069063-11-01-2018-11-36-30.jpg,"The Tashkent Files is a gripping thriller that revolves around the mysterious death of India's 2nd Prime Minister Shri Lal Bahadur Shastri and attempts to uncover if he had actually died a natural death, or, as alleged, was assassinated.",N/A,2 hrs 24 mins,0,1
Badla,"08 Mar, 2019",UA ,//in.bmscdn.com/iedb/movies/images/mobile/thumbnail/xlarge/badla-et00077951-19-06-2018-10-46-53.jpg,"A young dynamic entrepreneur finds herself in a locked hotel room next to the body of her dead lover. She hires a prestigious lawyer to defend her, and over the course of one evening, they work together to find out what actually happened.",N/A,2 hrs 00 mins,"65,677",1
Us,"29 Mar, 2019",A ,//in.bmscdn.com/iedb/movies/images/mobile/thumbnail/xlarge/usenglish-et00099516-25-03-2019-11-59-33.jpg,"On a visit to her beach-side childhood home along with her husband and two children, Adelaide Wilson finds herself haunted by traumatic events from her past, which are aggravated by certain eerie incidents in the house. Amidst her rising paranoia, new threats emerge from the darkness in the form of masked intruders, who appear to be her family`s doppelgangers.",N/A,1 hrs 56 mins,"1,625",1
Pet Sematary,"12 Apr, 2019",A ,//in.bmscdn.com/iedb/movies/images/mobile/thumbnail/xlarge/pet-sematary-et00099554-25-03-2019-04-38-50.jpg,"Louis and his wife Rachel relocate from Boston to rural Maine along with their two kids, where they come to know about the sinister pet sematary in the neighbourhood. After the death of their pet cat, Louis buries it in the sematary, which starts off a chain of horrific events and unleashes an unstoppable evil.",N/A,1 hrs 44 mins,0,1
Thadam,"01 Mar, 2019",UA ,//in.bmscdn.com/iedb/movies/images/mobile/thumbnail/xlarge/thadam-et00082524-27-08-2018-04-17-45.jpg,One murder; two suspects! A whodunit where each clue leads to more questions,N/A,2 hrs 18 mins,"17,697",1
Gangs Of Madras,"12 Apr, 2019",A ,//in.bmscdn.com/iedb/movies/images/mobile/thumbnail/xlarge/gangs-of-madras-et00082515-27-08-2018-03-39-56.jpg,"Gangs Of Madras is a Tamil movie starring Daniel Balaji, Kalaiarasan Harikrishnan and Bagavathi Perumal in prominent roles. It is a drama directed by C.V. Kumar.",N/A,2 hrs 22 mins,0,1
LKG,"22 Feb, 2019",U ,//in.bmscdn.com/iedb/movies/images/mobile/thumbnail/xlarge/lkg-et00076112-21-05-2018-02-14-40.jpg,"Lalgudi Karupaiah Gandhi aka LKG is a small-time politician who harbours the humble dream of being the state`s chief minister. Streetsmart, silver-tongued and crafty, he will go to any lengths to win in this political game of thrones!",N/A,2 hrs 04 mins,"14,967",1
Gully Boy,"14 Feb, 2019",UA ,//in.bmscdn.com/iedb/movies/images/mobile/thumbnail/xlarge/gully-boy-et00053235-08-02-2017-11-43-27.jpg,"22-year-old Murad is the son of a driver, hailing from a ghetto in Mumbai. While his parents expect him to land a white collar job, the youngster`s greatest passion is rap music. In a country where being an artist is often a far-fetched dream for the impoverished, Murad`s struggles to rise above his circumstances and become a musician will send ripples of hip-hop across all social classes, inspiring an entire generation of youngsters.",N/A,2 hrs 36 mins,"135,732",1
Avengers: Infinity War,"27 Apr, 2018",UA ,//in.bmscdn.com/iedb/movies/images/mobile/thumbnail/xlarge/avengers-infinity-war-et00053419-11-02-2017-08-16-41.jpg,"As the Avengers and their allies have continued to protect the world from threats too large for any one hero to handle, a new danger has emerged from the cosmic shadows: Thanos. A despot of intergalactic infamy, his goal is to collect all six Infinity Stones, artifacts of unimaginable power, and use them to inflict his twisted will on all of reality. Everything the Avengers have fought for has led up to this moment - the fate of Earth and existence itself has never been more uncertain.",N/A,2 hrs 29 mins,"563,431",1
Lakshmi's NTR,"29 Mar, 2019",U ,//in.bmscdn.com/iedb/movies/images/mobile/thumbnail/xlarge/lakshmi-s-ntr-et00062836-28-09-2017-04-51-54.jpg,"Lakshmi`s NTR explores some of the darkest and most secretive chapters in the personal and political life of legendary actor N.T. Rama Rao, and the events that unfolded following his marriage to Lakshmi Parvati. Directd by Ram Gopal Varma, the film stars P. Vijay Kumar and Yagna Shetty in central roles.",N/A,2 hrs 31 mins,"17,638",1
90 ML,"01 Mar, 2019",A ,//in.bmscdn.com/iedb/movies/images/mobile/thumbnail/xlarge/90-ml-et00071086-16-02-2018-12-04-46.jpg,"Thamara, Paru, Kajal and Suganya are four friends who are rather tired of their uneventful routine. However, things take a turn for the better with the arrival of a spirited and outgoing young woman named Rita, who encourages them to live their lives to the fullest.",N/A,2 hrs 05 mins,"4,952",1
Junglee,"29 Mar, 2019",UA ,//in.bmscdn.com/iedb/movies/images/mobile/thumbnail/xlarge/junglee-et00065129-13-11-2017-03-34-14.jpg,"On returning to the beloved elephant reserve once managed by his father, a young man encounters and takes on an international racket of poachers.",N/A,1 hrs 55 mins,"7,586",1
Fighting with My Family,"05 Apr, 2019",A ,//in.bmscdn.com/iedb/movies/images/mobile/thumbnail/xlarge/fighting-with-my-family-et00053344-10-02-2017-04-15-14.jpg,"Two siblings hailing from a wrestling family get the golden opportunity to try out for the WWE, but only one of them would make it. Both their talent and relationship will be put to the test as they set out to chase their wildest dreams.",N/A,1 hrs 49 mins,162,1
Argentina Fans Kaattoorkadavu,"22 Mar, 2019",U ,//in.bmscdn.com/iedb/movies/images/mobile/thumbnail/xlarge/argentina-fans-kaattoorkadavu-et00094468-21-01-2019-02-17-04.jpg,"A coming-of-age story about a group of die-hard fans of the Argentinian football team, as they navigate through the vicissitudes of life and the sport over the course of four football seasons.",N/A,2 hrs 20 mins,"7,828",1
Ganesha Meendum Santhipom,"05 Apr, 2019",U ,//in.bmscdn.com/iedb/movies/images/mobile/thumbnail/xlarge/ganesha-meendum-santhipom-et00094118-15-01-2019-01-00-05.jpg,A con artist finds himself in a world of trouble after stealing a local don`s beloved motorcycle. It will take him all his shrewdness and some help from a sharp-witted girl to get out of this sticky situation.,N/A,1 hrs 59 mins,119,1
Kavaludaari,"12 Apr, 2019",UA ,//in.bmscdn.com/iedb/movies/images/mobile/thumbnail/xlarge/kavalu-daari-et00067133-13-12-2017-09-37-12.jpg,"Two Bangalore cops investigate an old case which puts their wit, resolve and morals to the test. Will they be able to solve it?",N/A,2 hrs 25 mins,0,1
Oru Kadhai Sollatuma,"05 Apr, 2019",U ,//in.bmscdn.com/iedb/movies/images/mobile/thumbnail/xlarge/oru-kadhai-sollatuma-et00098481-11-03-2019-06-17-37.jpg,"Oscar-winning sound designer Resul Pookkutty takes on one of the most challenging projects of his career: recording the sounds of the Thrissur Pooram, the king of all Indian festivals which is more than a thousand years old. However, the road ahead is not going to be easy as a number of hurdles await him along the way.",N/A,1 hrs 42 mins,"2,586",1
Kudimagan,"05 Apr, 2019",U ,//in.bmscdn.com/iedb/movies/images/mobile/thumbnail/xlarge/kudimagan-et00099958-01-04-2019-05-50-46.jpg,Kudimagan is a Tamil movie starring Nanditha Jennifer and Sriram Parthasarathy in prominent roles. It is a drama directed & written by Sathieshwaran.,N/A,2 hrs 05 mins,24,1
Boomerang,"08 Mar, 2019",U ,//in.bmscdn.com/iedb/movies/images/mobile/thumbnail/xlarge/boomerang-et00071089-16-02-2018-12-27-09.jpg,Boomerang is a Tamil movie starring Atharvaa Murali and Megha Akash in prominent roles. It is an action romance thriller directed by R Kannan.,N/A,2 hrs 10 mins,"2,198",1
Rocky The Revenge,"12 Apr, 2019",UA ,//in.bmscdn.com/iedb/movies/images/mobile/thumbnail/xlarge/rocky-the-revenge-et00100561-09-04-2019-06-20-00.jpg,"Rocky The Revenge is a Tamil movie starring Srikanth, Eshanya Maheshwari and Nassar in prominent roles. It is a drama directed by KC Bokadia.",N/A,1 hrs 46 mins,0,1
Zhagaram,"11 Apr, 2019",U ,//in.bmscdn.com/iedb/movies/images/mobile/thumbnail/xlarge/zhagaram-et00093085-31-12-2018-11-17-36.jpg,"Zhagaram is a Tamil movie starring Eden Kuriakosse and Nandha Durairaj in prominent roles. It is a drama directed by Krish with Dharan Kumar as musician, forming part of the crew.",N/A,1 hrs 53 mins,0,1
To Let,"21 Feb, 2019",U ,//in.bmscdn.com/iedb/movies/images/mobile/thumbnail/xlarge/to-let-et00083726-11-09-2018-01-48-14.jpg,"Inspired by real life incidents, the film follows a middle-class couple and their young son as they travel the length and breadth of Chennai city in search of a new house. With just thirty days left for eviction, they will have to race against time and face all kinds of prejudice in their quest for an affordable place.",N/A,1 hrs 39 mins,941,1
Virus,"21 Feb, 2019",N/A,//in.bmscdn.com/iedb/movies/images/mobile/thumbnail/xlarge/virus-et00083111-04-09-2018-11-01-36.jpg,"A real life account of the deadly Nipah virus outbreak in Kerala, and the courageous fight put on by several individuals which helped to contain the epidemic. Directed by Aashiq Abu, the film stars Kunchacko Boban, Parvathy, Indrajith Sukumaran, Asif Ali, Tovino Thomas and Rima Kallingal in pivotal roles.",N/A,N/A,4727,0
Gun Pe Done,"21 Feb, 2019",N/A,//in.bmscdn.com/iedb/movies/images/mobile/thumbnail/xlarge/gun-pe-done-et00100459-09-04-2019-09-34-21.jpg,"The story of Gun Pe Done revolves around a new year`s eve party thrown by a bootlegging kingpin. Bootlegger Manik Singh and his gang want an item girl for the party which will be attended by his political cronies. However, Raziya, the dancer and her boyfriend Pancham are not too keen to entertain the hooch mafia.",N/A,N/A,82,0
Ek Haqiqat Ganga,"21 Feb, 2019",N/A,//in.bmscdn.com/iedb/movies/images/mobile/thumbnail/xlarge/ek-haqiqat-ganga-et00100321-05-04-2019-05-36-09.jpg,"Ek Haqiqat Ganga is a Hindi movie starring Raza Murad, Ritesh Bora and Pramod Moutho in prominent roles. It is a drama directed & written by Ritesh Bora with Milan Harish as musician, forming part of the crew.",N/A,N/A,205,0
Betiyon Ki Balle Balle (Kargil Se Kanyakumari),"21 Feb, 2019",N/A,//in.bmscdn.com/iedb/movies/images/mobile/thumbnail/xlarge/betiyon-ki-balle-balle-kargil-se-kanyakumari-et00099471-23-03-2019-01-43-01.jpg,"A social drama that delves into the pertinent issue of woman empowerment, Betiyon Ki Balle Balle is directed by Manoj Nathwani and stars Jeet Upendra, Firoz Irani and Shruti in key roles.",N/A,N/A,341,0
Marudhar Express,"21 Feb, 2019",N/A,//in.bmscdn.com/iedb/movies/images/mobile/thumbnail/xlarge/marudhar-express-et00081059-03-08-2018-12-13-46.jpg,"The story of an innocent man and his ambitious wife, who struggle with the pressure of childbirth right after their arranged marriage. Marudhar Express deals with all the problems a couple faces post an arranged marriage, in a hilarious way.",N/A,N/A,2549,0
Paharganj,"21 Feb, 2019",N/A,//in.bmscdn.com/iedb/movies/images/mobile/thumbnail/xlarge/paharganj-et00098659-13-03-2019-01-54-25.jpg,"In Paharganj, the dark underbelly of Delhi, an investigation into a gruesome murder leads two officers into unravelling a series of interconnected events involving a host of people with stories of their own.",N/A,N/A,4535,0
Blackboard VS Whiteboard,"21 Feb, 2019",N/A,//in.bmscdn.com/iedb/movies/images/mobile/thumbnail/xlarge/blackboard-vs-whiteboard-et00097286-25-02-2019-10-35-24.jpg,"As a student, Amit struggled to pass his school examinations and was afraid of competitions. However, with the help of his parents, he manages to become a primary teacher, and decides to help children carve a better future for themselves. For his first job, Amit gets posted to a government school, which is in a very bad condition and is illegally opened as a private school by the head of the village, much to the dismay of the school headmaster, Dinanath. ",N/A,N/A,3734,0
Albert Pinto Ko Gussa Kyun Aata Hai?,"21 Feb, 2019",N/A,//in.bmscdn.com/iedb/movies/images/mobile/thumbnail/xlarge/albert-pinto-ko-gussa-kyun-aata-hai-et00098114-06-03-2019-03-19-27.jpg,"A remake of the 1980s eponymous film, it is a take on anger and helplessness of the common man. When Albert leaves his house one morning without telling anyone his whereabouts, his girlfriend Stella files a complaint with the police and when he doesn`t return after days, she begins to worry.",N/A,N/A,1296,0
Five Feet Apart ,"21 Feb, 2019",N/A,//in.bmscdn.com/iedb/movies/images/mobile/thumbnail/xlarge/five-feet-apart-et00098578-12-03-2019-05-16-56.jpg,"Stella and Will, two teenagers with life-threatening illnesses, meet at a hospital and strike an instant connection. Will their ailments come in the way of their budding relationship? Based on the eponymous novel by Rachael Lippincott, the film stars Haley Lu Richardson and Cole Sprouse in the lead roles.",N/A,N/A,12408,0
Free Solo,"21 Feb, 2019",N/A,//in.bmscdn.com/iedb/movies/images/mobile/thumbnail/xlarge/free-solo-et00100607-10-04-2019-03-15-55.jpg,"An edge-of-the-seat thriller that celebrates an astounding human feat, the documentary chronicles free soloist climber Alex Honnold`s preparations leading up to achieving his lifelong dream: climbing the face of the renowned El Capitan`s one-kilometre vertical rock face at Yosemite National park...without a rope!",N/A,N/A,9,0
Lucifer ,"21 Feb, 2019",N/A,//in.bmscdn.com/iedb/movies/images/mobile/thumbnail/xlarge/lucifer-et00100355-07-04-2019-11-36-01.jpg,"In God`s own country, the supreme leader of the ruling party dies, leaving a huge vacuum, not only in the electoral and leadership sphere of the party but also that of the state. In the inevitable succession squabble and the power struggle that ensues, the thin line that separates good and bad becomes irrecoverably blurred and out of this seemingly endless mayhem, emerge forces that are hitherto unheard of. ",N/A,N/A,525,0
Sahasaputrudu,"21 Feb, 2019",N/A,//in.bmscdn.com/iedb/movies/images/mobile/thumbnail/xlarge/hellboy-et00099588-26-03-2019-10-54-38.jpg,"Based on the graphic novels by Mike Mignola, the film follows Hellboy - the beloved son of the Fallen One who is caught between the worlds of the supernatural and human. This time around, his formidable enemy is an ancient sorceress bent on revenge.",N/A,N/A,2049,0
Wedding Cha Shinema,"21 Feb, 2019",N/A,//in.bmscdn.com/iedb/movies/images/mobile/thumbnail/xlarge/wedding-cha-shinema-et00095100-29-01-2019-09-36-13.jpg,"An aspiring filmmaker from Mumbai reluctantly takes up the assignment of filming the wedding festivities in a small town in western Maharashtra. Once she gets there, she is drawn into the celebration, chaos and drama surrounding the family gathering. At the end of the crazy ride, both the big city filmmaker and the small town folks may have something to learn from each other.",N/A,N/A,950,0
Hridayi Vasant Phultana,"21 Feb, 2019",N/A,//in.bmscdn.com/iedb/movies/images/mobile/thumbnail/xlarge/hridayi-vasant-phultana-et00095554-04-02-2019-03-58-20.jpg,Hridayi Vasant Phultana is a Marathi movie starring Prathamesh Parab and Ritika Shrotri in prominent roles. The movie also stars Abhijit Amkar and Pranali Bhalerao. It is a drama directed by Milind Kavade.,N/A,N/A,176,0
Kahi Kshan Premache,"21 Feb, 2019",N/A,//in.bmscdn.com/iedb/movies/images/mobile/thumbnail/xlarge/kahi-kshan-premache-et00099304-19-03-2019-07-42-08.jpg,"Sunder Shinde makes a living as the sales representative for a spices company, and is the sole breadwinner in his family. He is hardworking yet underappreciated, and the pressure of his unrewarding job eventually takes a toll on his health. Will he be able to cope with this setback?",N/A,N/A,241,0
Night Out,"21 Feb, 2019",N/A,//in.bmscdn.com/iedb/movies/images/mobile/thumbnail/xlarge/night-out-et00095328-31-01-2019-04-42-43.jpg,"Two friends embark on an auto rickshaw ride in the night, which soon takes an unexpected turn with a series of surprises awaiting them. A psychological thriller directed by Rakesh Adiga, the film stars Bharath, Shruti Goradia and Akshay Pavar in central roles.",N/A,N/A,181,0
Athiran,"21 Feb, 2019",N/A,//in.bmscdn.com/iedb/movies/images/mobile/thumbnail/xlarge/athiran-et00098848-16-03-2019-01-23-01.jpg,"In an isolated hospital in the high ranges of Kerala, an autistic patient with special skills piques the interest of a psychiatrist, whose investigation into her past leads to startling revelations. Directed by debutant Vivek, Athiran is a gripping thriller which stars Fahadh Faasil and Sai Pallavi in central roles.",N/A,N/A,5528,0
Manje Bistre 2 ,"21 Feb, 2019",N/A,//in.bmscdn.com/iedb/movies/images/mobile/thumbnail/xlarge/manje-bistre-2-et00082993-03-09-2018-09-09-25.jpg,"The second installment in the Manje Bistre series revolves around Sukhi`s journey to Canada to attend his cousin`s marriage ceremony. The traditional big fat Punjabi wedding brings together an entire family full of amusing characters, while Sukhi falls in love with an Indo-Canadian named Rano. Packed with double the laughter and double the fun and frolic, the film stars Gippy Grewal in the lead role.",N/A,N/A,4928,0
Vinci Da,"21 Feb, 2019",N/A,//in.bmscdn.com/iedb/movies/images/mobile/thumbnail/xlarge/vinci-da-et00096267-10-02-2019-03-16-59.jpg,"The story of Vinci Da is about an obsessed make-up artiste, who has been struggling to make his own place in the industry, solely based on his talent and capabilities. Despite his father being a renowned make-up artiste, he could not follow his footsteps. His career took a further dip when his straightforwardness and arrogance resulted in him insulting three big personalities of the industry. However, his life changes forever after the entry of a well-wisher.",N/A,N/A,2580,0
Tarikh,"21 Feb, 2019",N/A,//in.bmscdn.com/iedb/movies/images/mobile/thumbnail/xlarge/tarikh-et00098171-07-03-2019-09-36-29.jpg,"A profound examination of life, death, hope and immortality, Tarikh gives us a peep into the inner worlds and beliefs of three people: Anirban an idealist, Ira a conformist and Rudrangshu a realist; all of whom are bound by friendship. Directed by Churni Ganguly, the film stars Raima Sen, Saswata Chatterjee, Ritwick Chakraborty and Kaushik Ganguly in central roles",N/A,N/A,428,0
Tui Amar Rani,"21 Feb, 2019",N/A,//in.bmscdn.com/iedb/movies/images/mobile/thumbnail/xlarge/tui-amar-rani-et00099839-29-03-2019-04-36-30.jpg,"Raja, a law student, falls for the daughter of Shivram, a powerful local figure with whom he has had issues in the past. Is there a happy ending for the young couple or will Shivram stand between them?",N/A,N/A,93,0
Kachindo,"21 Feb, 2019",N/A,//in.bmscdn.com/iedb/movies/images/mobile/thumbnail/xlarge/kachindo-rang-badalta-manso-et00098782-15-03-2019-11-49-52.jpg,"Happily married and settled in Paris along with her husband and five-month-old baby, Lajja had it all until the day her world turned upside down. After her husband and child go missing, she is drawn into a strange labyrinth of deceit, with all evidence pointing to her marital life being a lie. As the line between truth and lie is blurred and even bloodied by a brutal murder, the young woman`s life spirals out of control.",N/A,N/A,399,0
Kalank,"21 Feb, 2019",N/A,//in.bmscdn.com/iedb/movies/images/mobile/thumbnail/xlarge/kalank-et00074273-18-04-2018-10-27-54.jpg,"Set in 1945, in Pre-Independence India, Kalank is a tale of eternal love.",N/A,N/A,50643,0
Payanigaru,"21 Feb, 2019",N/A,//in.bmscdn.com/iedb/movies/images/mobile/thumbnail/xlarge/payanigaru-et00100189-04-04-2019-10-26-58.jpg,"Hoping to take a short break from the humdrum routine of work and familial responsibilities, five friends embark on a road trip from Bangalore to Goa. But life has charted out its own unexpected course for these men, as the fun trip becomes a life-changing journey.",N/A,N/A,148,0
The Curse Of The Weeping Woman,"21 Feb, 2019",N/A,//in.bmscdn.com/iedb/movies/images/mobile/thumbnail/xlarge/la-llorona-et00086600-18-10-2018-12-12-44.jpg,"When the lives of her children are endangered by an evil spirit, a single mother seeks the help of a priest to escape a tragic fate. Set in Los Angeles in the 1970s, the horror thriller brings alive the Latin American legend of La Llorona, who is believed to stalk the night and prey on children.",N/A,N/A,21457,0
